{
  "$schema": "http://json-schema.org/draft-07/schema#",
  "$id": "question-definition.schema.json",
  "title": "QuestionDefinition",
  "description": "A single training question. Fields that reveal the answer (symbol, startTime, endTime, future, answer) must not be shown to the user before they submit their call.",
  "type": "object",
  "required": ["id", "assetClass", "timeframe", "horizon", "symbol", "startTime", "endTime", "setup", "future", "answer"],
  "additionalProperties": false,
  "properties": {
    "id": {
      "type": "string",
      "minLength": 1,
      "description": "Stable opaque hash. Does not contain the symbol or dates."
    },
    "assetClass": {
      "type": "string",
      "enum": ["equity", "crypto", "forex", "commodity", "index"]
    },
    "timeframe": {
      "type": "string",
      "enum": ["1m", "1h", "1d", "1mo"]
    },
    "horizon": {
      "type": "integer",
      "minimum": 1,
      "description": "Number of future bars the user is predicting."
    },
    "symbol": {
      "type": "string",
      "minLength": 1,
      "description": "Reveal-only: must not be shown before the user answers."
    },
    "startTime": {
      "type": "integer",
      "minimum": 0,
      "description": "Unix UTC seconds of the first setup bar. Reveal-only."
    },
    "endTime": {
      "type": "integer",
      "minimum": 0,
      "description": "Unix UTC seconds of the last future bar. Reveal-only."
    },
    "setup": {
      "type": "array",
      "minItems": 1,
      "items": { "$ref": "#/definitions/bar" },
      "description": "Bars shown to the user during the question. No timestamps."
    },
    "future": {
      "type": "array",
      "minItems": 1,
      "items": { "$ref": "#/definitions/bar" },
      "description": "Reveal-only: bars animated after the user answers. Must not be accessed before given is recorded."
    },
    "answer": {
      "type": "string",
      "enum": ["up", "down"],
      "description": "Reveal-only: pre-computed correct direction."
    }
  },
  "definitions": {
    "bar": {
      "type": "object",
      "required": ["o", "h", "l", "c", "v"],
      "additionalProperties": false,
      "properties": {
        "o": { "type": "number", "exclusiveMinimum": 0 },
        "h": { "type": "number", "exclusiveMinimum": 0 },
        "l": { "type": "number", "exclusiveMinimum": 0 },
        "c": { "type": "number", "exclusiveMinimum": 0 },
        "v": { "type": "integer", "minimum": 1 }
      }
    }
  }
}
