[
  {
    "id": "fx6750fa3dc0",
    "assetClass": "equity",
    "timeframe": "1d",
    "horizon": 5,
    "symbol": "AAPL",
    "startTime": 1704067200,
    "endTime": 1704499200,
    "setup": [
      {
        "o": 150.0,
        "h": 150.6786,
        "l": 149.8961,
        "c": 150.3552,
        "v": 758223
      },
      {
        "o": 150.3552,
        "h": 150.5008,
        "l": 150.1826,
        "c": 150.4265,
        "v": 1210187
      },
      {
        "o": 150.4265,
        "h": 150.7426,
        "l": 150.022,
        "c": 150.2211,
        "v": 1053780
      },
      {
        "o": 150.2211,
        "h": 151.1907,
        "l": 150.1534,
        "c": 150.9682,
        "v": 1034289
      },
      {
        "o": 150.9682,
        "h": 151.5945,
        "l": 150.9254,
        "c": 151.4459,
        "v": 1069279
      },
      {
        "o": 151.4459,
        "h": 151.7794,
        "l": 151.1738,
        "c": 151.6605,
        "v": 803785
      },
      {
        "o": 151.6605,
        "h": 152.1649,
        "l": 151.2819,
        "c": 151.8186,
        "v": 1251099
      },
      {
        "o": 151.8186,
        "h": 152.8591,
        "l": 151.7339,
        "c": 152.5764,
        "v": 1003343
      },
      {
        "o": 152.5764,
        "h": 152.9948,
        "l": 152.247,
        "c": 152.9734,
        "v": 1348380
      },
      {
        "o": 152.9734,
        "h": 153.1874,
        "l": 152.3116,
        "c": 152.5488,
        "v": 1098217
      },
      {
        "o": 152.5488,
        "h": 152.8822,
        "l": 152.0565,
        "c": 152.1554,
        "v": 744056
      },
      {
        "o": 152.1554,
        "h": 152.7498,
        "l": 152.0532,
        "c": 152.5268,
        "v": 1070389
      },
      {
        "o": 152.5268,
        "h": 152.5933,
        "l": 151.954,
        "c": 152.3182,
        "v": 762312
      },
      {
        "o": 152.3182,
        "h": 152.8152,
        "l": 152.2884,
        "c": 152.4469,
        "v": 825622
      },
      {
        "o": 152.4469,
        "h": 153.0338,
        "l": 152.1205,
        "c": 152.7514,
        "v": 1310744
      },
      {
        "o": 152.7514,
        "h": 152.7836,
        "l": 152.0805,
        "c": 152.3237,
        "v": 779586
      },
      {
        "o": 152.3237,
        "h": 153.2943,
        "l": 152.0046,
        "c": 152.9224,
        "v": 1327147
      },
      {
        "o": 152.9224,
        "h": 153.283,
        "l": 152.3317,
        "c": 152.5251,
        "v": 1009228
      },
      {
        "o": 152.5251,
        "h": 153.2072,
        "l": 152.2429,
        "c": 153.1788,
        "v": 775010
      },
      {
        "o": 153.1788,
        "h": 153.4417,
        "l": 152.6718,
        "c": 152.7193,
        "v": 1372126
      },
      {
        "o": 152.7193,
        "h": 153.1716,
        "l": 152.6972,
        "c": 152.923,
        "v": 1015640
      },
      {
        "o": 152.923,
        "h": 153.0267,
        "l": 152.3983,
        "c": 152.4917,
        "v": 1143253
      },
      {
        "o": 152.4917,
        "h": 153.3593,
        "l": 152.3602,
        "c": 153.0015,
        "v": 1078096
      },
      {
        "o": 153.0015,
        "h": 153.1976,
        "l": 152.8483,
        "c": 152.8688,
        "v": 1011781
      },
      {
        "o": 152.8688,
        "h": 153.4268,
        "l": 152.6946,
        "c": 153.1806,
        "v": 818912
      },
      {
        "o": 153.1806,
        "h": 153.3718,
        "l": 152.6679,
        "c": 153.014,
        "v": 794737
      },
      {
        "o": 153.014,
        "h": 153.3906,
        "l": 152.6985,
        "c": 153.2852,
        "v": 856009
      },
      {
        "o": 153.2852,
        "h": 154.094,
        "l": 153.0112,
        "c": 153.9918,
        "v": 1062230
      },
      {
        "o": 153.9918,
        "h": 154.3889,
        "l": 153.7602,
        "c": 154.0436,
        "v": 1089683
      },
      {
        "o": 154.0436,
        "h": 154.5281,
        "l": 153.9788,
        "c": 154.3716,
        "v": 1322340
      },
      {
        "o": 154.3716,
        "h": 155.0035,
        "l": 154.3514,
        "c": 154.8068,
        "v": 1299173
      },
      {
        "o": 154.8068,
        "h": 155.0996,
        "l": 154.7654,
        "c": 154.8173,
        "v": 1081904
      },
      {
        "o": 154.8173,
        "h": 155.4308,
        "l": 154.7852,
        "c": 155.3768,
        "v": 1323554
      },
      {
        "o": 155.3768,
        "h": 156.0517,
        "l": 155.3293,
        "c": 155.8953,
        "v": 1023057
      },
      {
        "o": 155.8953,
        "h": 155.9878,
        "l": 155.7665,
        "c": 155.9351,
        "v": 1058471
      },
      {
        "o": 155.9351,
        "h": 156.2893,
        "l": 155.6597,
        "c": 155.8253,
        "v": 1178777
      },
      {
        "o": 155.8253,
        "h": 156.0345,
        "l": 155.462,
        "c": 155.5771,
        "v": 759080
      },
      {
        "o": 155.5771,
        "h": 155.6397,
        "l": 155.096,
        "c": 155.3928,
        "v": 765111
      },
      {
        "o": 155.3928,
        "h": 155.7106,
        "l": 155.1917,
        "c": 155.4773,
        "v": 997165
      },
      {
        "o": 155.4773,
        "h": 156.1027,
        "l": 155.4018,
        "c": 155.8617,
        "v": 1311292
      },
      {
        "o": 155.8617,
        "h": 156.1565,
        "l": 155.2718,
        "c": 155.4865,
        "v": 1349272
      },
      {
        "o": 155.4865,
        "h": 155.7677,
        "l": 155.3951,
        "c": 155.6352,
        "v": 1242599
      },
      {
        "o": 155.6352,
        "h": 155.9565,
        "l": 155.248,
        "c": 155.8487,
        "v": 913747
      },
      {
        "o": 155.8487,
        "h": 156.2727,
        "l": 155.5812,
        "c": 156.1446,
        "v": 1049135
      },
      {
        "o": 156.1446,
        "h": 156.2448,
        "l": 155.3781,
        "c": 155.6908,
        "v": 990427
      },
      {
        "o": 155.6908,
        "h": 155.9031,
        "l": 155.3587,
        "c": 155.6179,
        "v": 756454
      },
      {
        "o": 155.6179,
        "h": 155.7146,
        "l": 155.2068,
        "c": 155.3214,
        "v": 888078
      },
      {
        "o": 155.3214,
        "h": 155.6839,
        "l": 154.6653,
        "c": 155.0447,
        "v": 1379999
      },
      {
        "o": 155.0447,
        "h": 155.1111,
        "l": 154.2863,
        "c": 154.606,
        "v": 1217477
      },
      {
        "o": 154.606,
        "h": 155.4978,
        "l": 154.5083,
        "c": 155.1213,
        "v": 1098606
      },
      {
        "o": 155.1213,
        "h": 155.2462,
        "l": 154.7593,
        "c": 154.846,
        "v": 877227
      },
      {
        "o": 154.846,
        "h": 155.5515,
        "l": 154.7928,
        "c": 155.1801,
        "v": 1366428
      },
      {
        "o": 155.1801,
        "h": 155.243,
        "l": 154.5698,
        "c": 154.9546,
        "v": 738102
      },
      {
        "o": 154.9546,
        "h": 155.1956,
        "l": 154.5353,
        "c": 154.7815,
        "v": 1104692
      },
      {
        "o": 154.7815,
        "h": 154.9108,
        "l": 154.4299,
        "c": 154.5408,
        "v": 1120942
      },
      {
        "o": 154.5408,
        "h": 155.3739,
        "l": 154.2806,
        "c": 155.249,
        "v": 876605
      },
      {
        "o": 155.249,
        "h": 156.2171,
        "l": 155.0371,
        "c": 156.0068,
        "v": 1121172
      },
      {
        "o": 156.0068,
        "h": 156.2426,
        "l": 155.7315,
        "c": 156.1066,
        "v": 955848
      },
      {
        "o": 156.1066,
        "h": 156.8969,
        "l": 155.7882,
        "c": 156.5089,
        "v": 1053030
      },
      {
        "o": 156.5089,
        "h": 157.4957,
        "l": 156.3388,
        "c": 157.2599,
        "v": 1087965
      }
    ],
    "future": [
      {
        "o": 157.2599,
        "h": 159.4787,
        "l": 157.1772,
        "c": 159.4514,
        "v": 1009487
      },
      {
        "o": 159.4514,
        "h": 162.3906,
        "l": 159.2421,
        "c": 162.2053,
        "v": 824886
      },
      {
        "o": 162.2053,
        "h": 164.725,
        "l": 161.8791,
        "c": 164.5933,
        "v": 965899
      },
      {
        "o": 164.5933,
        "h": 167.278,
        "l": 164.4931,
        "c": 167.2169,
        "v": 1001049
      },
      {
        "o": 167.2169,
        "h": 170.0259,
        "l": 167.1924,
        "c": 169.8176,
        "v": 1287462
      }
    ],
    "answer": "up"
  },
  {
    "id": "fx3fc326f9b5",
    "assetClass": "equity",
    "timeframe": "1d",
    "horizon": 5,
    "symbol": "MSFT",
    "startTime": 1704153600,
    "endTime": 1704585600,
    "setup": [
      {
        "o": 200.0,
        "h": 200.4953,
        "l": 199.6111,
        "c": 200.3915,
        "v": 1634382
      },
      {
        "o": 200.3915,
        "h": 201.0196,
        "l": 200.1103,
        "c": 200.5505,
        "v": 1358668
      },
      {
        "o": 200.5505,
        "h": 200.819,
        "l": 200.4296,
        "c": 200.6834,
        "v": 1402995
      },
      {
        "o": 200.6834,
        "h": 201.2991,
        "l": 200.6128,
        "c": 201.0519,
        "v": 1402885
      },
      {
        "o": 201.0519,
        "h": 201.6801,
        "l": 200.7725,
        "c": 201.2387,
        "v": 1239447
      },
      {
        "o": 201.2387,
        "h": 201.2827,
        "l": 200.241,
        "c": 200.7008,
        "v": 1616651
      },
      {
        "o": 200.7008,
        "h": 201.1268,
        "l": 200.0934,
        "c": 200.4471,
        "v": 918578
      },
      {
        "o": 200.4471,
        "h": 201.5604,
        "l": 199.9663,
        "c": 201.4138,
        "v": 862061
      },
      {
        "o": 201.4138,
        "h": 201.9226,
        "l": 201.2452,
        "c": 201.6782,
        "v": 1378638